{
  "answer_pack_id": "apack_example_001",
  "schema_version": "0.11.0",
  "question_pack_id": "qpack_example_001",
  "intent_id": "intent_example_001",
  "answers": [
    {
      "question_id": "q_target_file",
      "answer_type": "text",
      "answer_text": "docs/example/README.md",
      "evidence_refs": [
        "file://docs/example/",
        "pattern://docs/**/*.md"
      ],
      "confidence": 0.95,
      "provided_at": "2026-01-26T10:00:00Z",
      "provided_by": "human",
      "rationale": "Target file confirmed by user"
    },
    {
      "question_id": "q_operation_type",
      "answer_type": "choice",
      "answer_text": "update",
      "answer_data": {
        "selected_option": "update",
        "alternatives": ["create", "delete"]
      },
      "evidence_refs": [
        "intent://update documentation",
        "context://file exists"
      ],
      "confidence": 1.0,
      "provided_at": "2026-01-26T10:01:00Z",
      "provided_by": "human",
      "rationale": "File exists, operation is update"
    }
  ],
  "provided_at": "2026-01-26T10:02:00Z",
  "completeness": {
    "total_questions": 2,
    "answered": 2,
    "unanswered_question_ids": [],
    "fallback_used": false
  },
  "lineage": {
    "nl_request_id": "nl_req_example_001",
    "pipeline_run_id": "run_example_001",
    "created_by": "human_operator",
    "created_at": "2026-01-26T10:02:00Z"
  },
  "checksum": "a1b2c3d4e5f6g7h8i9j0k1l2m3n4o5p6q7r8s9t0u1v2w3x4y5z6a7b8c9d0e1f2",
  "metadata": {
    "answerer_id": "user@example.com",
    "session_id": "session_001",
    "tool_used": "cli"
  }
}
